final_text,label
laporan jalan berlubang pothole dan permohonan penanganan adanya jalan berlubang pothole yang berpotensi membahayakan keselamatan pengguna jalan lokasi jalan sersan bajuri no kel isola kec sukasari kota bandung jawa barat link kondisi jalan berlubang tersebut berisiko menimbulkan kecelakaan lalu lintas khususnya bagi pengendara sepeda motor serta dapat menyebabkan kerusakan kendaraan dan mengganggu kelancaran arus lalu lintas sebagai dasar pemeliharaan dan perbaikan jalan merupakan tanggung jawab penyelenggara jalan sebagaimana diatur dalam peraturan perundang undangan terkait jalan dan keselamatan lalu lintas sehubungan dengan hal tersebut kami memohon agar laporan ini dapat ditindaklanjuti melalui koordinasi dan eskalasi kepada dinas instansi berwenang untuk dilakukan pengecekan lapangan serta perbaikan secepatnya demikian laporan ini kami sampaikan atas perhatian dan tindak lanjutnya kami ucapkan kami pelapor,HIGH
bpkb hilang untuk bapenda jabar saya mohon di tindak lanjuti ke samsat sumedang saya pemilik motor honda astrea grand tahun pada tahun kemarin waktu ada program bbn gratis saya balik nama motor saya melalui orang samsat sumedang dengan nama bapak engkos orangnya berkumis saya sampai sekarang belum menerima bpkb hanpir sudah tahun saya pernah datang ke samsat sumedang menanyakan ke bapak engkos dia ngasi penjelasan ke saya kayanya bpkb tertukar atau hilang di samsat saya bingung motor saya jadi tidak ada bpkbnya padahal motor saya tidak bodong boleh di cek plat no z cza mohon untuk bapenda jabar kasih solusi ke saya dan samsat sumedang karena saya merasa sudah di rugikan,LOW
informasi bibit ayam assalamualaikum izin bertanya apakah di dinas perikanan dan peternakan sumedang ada bibit ayam kub,LOW
mohon segera di selesaikan pelebaran jalan jatinunggal sumedang dikarenakan banyak aktivitas masyarakat yang terganggu selama bulan lebih dan membahayakan pengguna jalan mohon agar proyek pelebaran jalan di jatinunggal segera di selesaikan secepatnya kami mohon segera di selesaikan dan di percepat karena mobil tidak bisa masuk garasi dan membahayakan pengguna jalan tolong perbaiki tembok jalan warga yang di rusak oleh beko kami mohon perhatian nya dan di perhatikan lokasi blok jatinunggal dekat polsek kebawah,MEDIUM
transportasi tmb kenapa selalu lama ya bus tmb koridor saya nunggu sekitar jam di halte flyover cikapayang apa rubah rute atau gimana,HIGH
pengaduan kinerja ketua rukun warga di tingkat kelurahan kami yang bertanda tangan di bawah ini mewakili para ketua rukun tetangga serta warga masyarakat rukun warga kelurahan sukawarna kecamatan sukajadi dengan ini menyampaikan pengaduan masyarakat terkait tidak optimalnya tindak lanjut pihak kelurahan sukawarna terhadap permasalahan kinerja ketua rukun warga yang telah disampaikan secara resmi oleh warga adapun pengaduan ini kami sampaikan berdasarkan kronologis sebagai berikut berdasarkan laporan dan aspirasi warga dari seluruh rukun tetangga rukun tetangga s d rukun tetangga di wilayah rukun warga kelurahan sukawarna koordinator rukun tetangga telah melaksanakan rapat khusus yang dihadiri oleh para ketua rukun tetangga rapat tersebut membahas tidak optimalnya kinerja ketua rukun warga dalam menjalankan tugas dan fungsi sebagaimana mestinya dari hasil rapat tersebut disepakati bersama untuk membuat surat mosi tidak percaya terhadap ketua rukun warga sebagai bentuk aspirasi resmi warga setelah terbitnya surat mosi tidak percaya kemudian diselenggarakan rapat yang dihadiri oleh ketua rukun warga ketua rukun tetangga tokoh masyarakat serta perwakilan warga dalam rapat tersebut ketua rukun warga menyatakan tidak bersedia mengundurkan diri sehingga warga dan para ketua rukun tetangga memutuskan untuk meneruskan surat mosi tidak percaya tersebut kepada pihak kelurahan sukawarna guna ditindaklanjuti sesuai dengan kewenangan dan mekanisme yang berlaku setelah surat diterima oleh pihak kelurahan jawaban yang diberikan memerlukan waktu kurang lebih lebih dari satu minggu menurut pandangan dan penilaian kami jawaban serta solusi yang disampaikan oleh pihak kelurahan tidak memuaskan dan tidak menyentuh substansi permasalahan pihak kelurahan hanya menyarankan untuk kembali mengadakan rapat atau rembug warga rukun warga yang melibatkan ketua rukun warga ketua rukun tetangga tokoh agama tokoh masyarakat dan perwakilan warga padahal rapat tersebut pada prinsipnya telah dilakukan dan dalam forum tersebut telah jelas dan tegas disampaikan kehendak mayoritas warga rukun warga untuk mengganti ketua rukun warga oleh karena itu koordinator rukun tetangga serta warga berharap bapak lurah secara aktif memanggil ketua rukun warga beserta jajaran terkait untuk mengklarifikasi penyebab timbulnya surat mosi tidak percaya dari warga rukun warga bukan sekadar mengembalikan persoalan kepada warga melalui rapat ulang karena lamanya respons dan tidak adanya tindak lanjut yang nyata dari pihak kelurahan maka surat mosi tidak percaya tersebut kami lanjutkan kepada pihak kecamatan sukajadi yang kemudian memberikan respons dengan sangat baik setelah adanya tindak lanjut dari pihak kecamatan barulah pihak kelurahan mengeluarkan surat undangan rapat yang ditujukan kepada ketua rukun warga para ketua rukun tetangga tokoh masyarakat tokoh agama serta perwakilan warga melalui pengaduan ini kami memohon perhatian dan tindak lanjut yang tegas serta terukur dari dinas terkait dengan harapan agar dilakukan evaluasi secara menyeluruh objektif dan akuntabel terhadap penanganan pengaduan warga rukun warga terhadap pihak kelurahan sukawarna mengingat pelayanan dan respons yang diberikan dinilai tidak memuaskan serta belum mencerminkan prinsip pelayanan publik yang responsif dan profesional sehingga perlu dilakukan perbaikan secara nyata aspirasi dan kehendak mayoritas warga rukun warga dipertimbangkan dan ditindaklanjuti secara serius sebagai bagian dari pelaksanaan prinsip akuntabilitas pemerintahan pelayanan publik yang baik serta demokrasi di tingkat lingkungan tindak lanjut atas pengaduan ini dapat disampaikan kepada warga dalam jangka waktu yang wajar dan jelas agar tidak menimbulkan ketidakpastian serta menjaga kepercayaan masyarakat terhadap penyelenggaraan pemerintahan di tingkat kelurahan dan kecamatan demikian pengaduan ini kami sampaikan dengan sebenar benarnya besar harapan kami agar pengaduan ini memperoleh perhatian serius serta tindak lanjut yang konkret dan terukur sebagaimana mestinya atas perhatian bapak kami ucapkan kami perwakilan koordinator rukun tetangga dan warga rukun warga kelurahan sukawarna kecamatan sukajadi,LOW
rumah tidak layak huni sudahmau roboh ibu bapak yang ter saya mau pengaduan tentang bantuan rumah tidak layak huni untuk di renovasi saya sudah melaporkan ke desa rancamulya kec sumedang utara sudah tahun tapi belum ada kelanjutan setiap di tanyakan ke desa alasannya belum ada anggaran saya minta tolong bantuannya bapak ibu sebelum ada korban jiwa tertimpa atap rumah,MEDIUM
permohonan surat declaration of residence nationality and marital status yth bapak ibudinas kependudukan dan pencatatan sipil kota bandung perkenalkan saya santi velantia warga negara indonesia dengan ktp kota bandung saat ini saya sedang mempersiapkan dokumen untuk keperluan administrasi pernikahan dengan warga negara asing di belanda salah satu dokumen yang dipersyaratkan oleh pihak otoritas setempat adalah declaration of residence nationality and marital status yang akan digunakan untuk proses administrasi di belanda dan selanjutnya diajukan apostille di kementerian hukum dan ham republik indonesia sehubungan dengan hal tersebut saya ingin menanyakan apakah disdukcapil kota bandung dapat menerbitkan surat keterangan yang memuat informasi mengenai domisili alamat tempat tinggal kewarganegaraan wni status perkawinan belum menikah apa saja persyaratan dokumen yang perlu saya siapkan untuk pengajuan surat tersebut informasi ini sangat saya perlukan agar dokumen yang diterbitkan sesuai dengan ketentuan yang berlaku untuk penggunaan di luar negeri atas perhatian dan bantuan bapak ibu saya ucapkan,LOW
apakah mobil truk wajib kir apakah mobil mobil truk yang beroperasi dijalan sumedang kir nya masih aktif dan selalu dilakukan pengecekan terutama untuk truk truk yang overload apakah sudah ada uji pemeriksaannya bolehkah hasil kegiatan yang paling terbarunya dipublikasikan untuk umum,MEDIUM
membuat kartu keluarga katanya bisa membuat kartu keluarga secara online di aplikasi tahu sumedng tapi kok punya saya di batalkan terus ya begimana ini teh saya tidak ada waktu mengurus secara online tolong lah di permudah giliran menyalahkan pemerintah malah tidak mau giliran di turutin aturan nyah malah di persulit di per susah,LOW
permohonan bantuan benih ikan untuk mendapatkan nilai tambah penghasilan apakah anggota kelompok tani bisa mendapatkan bantuan benih ikan bapak makasih,LOW
perusahaan daerah air minum kabupaten sumedang terjadi kejanggalan biaya lonjakan penggunaan layanan penagihan pada perusahaan daerah air minum id pelanggan an h joko s di periode dan periode sementara penggunaan air tidak digunakan secara wajar hampir tidak pernah digunakan tempat tersebut sudah kosong selama bulan dan penggunaan debit air dirasa tidak digunakan selama bulan terakhir mohon petugas memastikan pengecekan kondisi alat ukur dan validitas harga terhadap nilai yang ditagihkan karena mengakibatkan kerugian bagi pelanggan demikian,LOW
pembelian bibit ikan dipalih dieu icalan bibit lauk,LOW
permohonan perbaikan dinding atau tembok batas sungai cikelay telah terjadi roboh rusaknya dinding tembok batu kirmir di aliran sungai cikiley di belakang gsg rukun warga jalan tanjungsari raya kelurahan antapani wetan kecamatan antapani hal tersebut berpotensi menimbulkan banjir serta membahayakan masyarakat kami memohon agar dapat diperbaiki dinding tembok batu kirmir tersebut pihak pengurus rukun warga telah melaporkan kejadian ini ke tingkat kelurahan sejak oktober dan direspon oleh tim kelurahan namun sampai saat ini belum ditindaklanjuti,HIGH
pertanyaan pembuatan ktp online saya mau buat ktp baru tapi layanan sedang tidak tersedia di silasidakep kira kira kapan layanan bisa digunakan,LOW
permintaan konfirmasi dari wartawan media masa radar sumedang rs an tribuana terkait tindaklanjut terhadap warga terdampak bencana longsor di desa cisalak kecamatan cisarua kabupaten sumedang minta konfirmasi sampai sejauh mana tindaklanjut dari pemerintah kecamatan cisarua terhadap warga terdampak bencana longsor di desa cisalak kecamatan cisarua kabupaten sumedang,LOW
tidak adanya dokter pengganti saat dokter spesialis cuti hari kerja kronologi kejadian tanggal desember pukul wib pasien datang ke igd membawa hasil rontgen dari rs pakuwon alasan pindah dari rs pakuwon ke rsud sumedang karena dari orthopedi di rs pakuwon tidak ada sebelumnya pasien pernah dibawa ke ahli tulang tidak dilakukan tindakan apa apa oleh ahli tulang hanya dioles minyak dan dibungkus plastik wrap kondisi dari hasil rontgen tangan patah ada dokter laki laki yang jaga pagi di igd sangat tidak humanis berkata yang menyakiti hati pasien dan keluarga pasien tidak ada kode etik ari geus dibawa ka dokter kampung geus buruk karek dibawa kadieu kondisi pasien ada luka dalam kenapa tidak direkomendasikan dulu ke dokter bedah ada pembiaran merujuk ke mal praktek pasien datang ke igd dengan jaminan bpjs keluarga pasien meminta di rujuk ke rs di bandung ditolak igd tidak diberi rujukan lalu keluarga pasien meminta pasien dirujuk ke rs al islam sebagai pasien umum disurat rujukan hanya tertulis pasien jatuh sudah berobat ke dokter kampung tidak ada catatan dari spesialis orthopedi cuti rujukan tidak diterima oleh rs al islam disuruh pulang rujukan tidak jelas keluarga pasien diarahkan untuk berobat ke poli orthopedi pada tanggal desember dari spesialis ortopedi masih cuti sampai tanggal desember pasien berobat ke poli orthopedi tanpa diberi obat keluarga pasien yang meminta obat kepada dokter yang periksa pasien di rujuk ke rs al islam di rs bandung bertanya kenapa baru dirujuk sekarang jadi tidak mau ambil resiko ambil tindakanpengaduan keluraga pasien indikasi ada pelanggaran secara administrasi terkait sop kalau ada dokter spesialis cuti lebih dari hari harus ada dokter pengganti ini cuti hari kerja tidak ada dokter pengganti pelayanan igd tidak humanis ada kata kata yang tidak enak dari dokter jaga igd yang dinas pagi punten kaji lagi untuk diagnosanya seandainya masih bisa ditangani di rsud sumedang lebih baik jangan sampai rs yang lain jadi ada masalah kedepannya,HIGH
progress realisasi kawasan industri ijin kalau boleh tau peta kawasan industri yang akan segera terealisasikan wilayah mana aja ya,LOW
tpt halaman rumah ambruk akibat intensitas hujan lebat um at april pkl wiblokasi dusun cibawang rukun tetangga rukun warga desa sukasirnarasa kec rancakalongpada hari jumat april pukul wib cuaca extreme hujan dengan intensitas tinggi mengakibatkan tpt halaman rumah longsor panjang meter dan tinggi meter,HIGH
jatinangor darurat sampah mohon bantuan untuk pembersihan sampah berdasarkan laporan warga perumahan jatinangor city park janaty park desa cibeusi kecamatan jatinangor banyak warga yang mengeluhkan asap akibat pembakaran sampah oleh pihak yang tidak bertanggung jawab sehingga menyebabkan kesehatan terganggu asap sisa pembakaran sampah telah menyebabkan kesehatan masyarakat terganggu seperti batuk batuk dan sesak napas sampah yang dibakar berasal dari tumpukan sampah yang dibuang orang tidak bertanggung jawab di sekitar janaty park dari hasil pemantauan terdapat beberapa orang yang membuang sampah yang berasal dari tempat yang jauh dan sengaja membuang sampah di janaty park hal ini antara lain disebabkan banyaknya akses atau jalan tikus menuju perumahan janaty park sehingga sulit untuk mencegah orang membuang sampah di sekitar janaty park menindaklanjuti hal tersebut warga rukun warga bersama pihak desa cibeusi dan pt koryza selaku pengembang perumahan janaty park telah melakukan kerja bakti sebanyak kali untuk membersihkan tumpukan sampah tersebut bahkan pada kerja bakti yang kedua warga juga telah bekerja sama dengan sekitar orang mahasiswa itb untuk membersihkan sampah namun setelah bersih masyarakat tetap membuang dan membakar sampah sembarangan warga telah mencurahkan tenaga waktu dan dana untuk membersihkan sampah tersebut namun hasilnya sia sia karena masyarakat tetap membuang dan membakar sampah sembarangan untuk itu dimohon bantuan kepada pemerintah dan pihak pihak terkait untuk mendorong pt koryza selaku developer untuk segera menutup akses akses jalan atau jalan tikus yang sering dijadikan akses jalan bagi warga sekitar untuk membuang dan membakar sampah sembarangan memohon bantuan kepada dinas lingkungan hidup untuk a membantu membersihkan sampah dilokasi yang sering dijadikan tempat pembuangan dan pembakaran sampah b mengedukasi masyarakat di lingkungan rukun warga rukun warga dan rukun warga desa cibeusi dan sekitarnya agar tidak membuang sampah sembarangan c mendorong pihak desa cibeusi untuk segera menyusun dan menerapkan pengelolaan sampah di lingkungan desa cibeusi karena statusnya sudah darurat sampah d mendorong pt koryza selaku pengembang perumahan untuk tidak membakar sampah di lingkungan koryza selama ini pengelolaan sampah oleh pt koryza adalah dibakar dilahan kosong milik koryza,HIGH
permohonan informasi terkait isu strategis rpjmd assalamualaikum selamat pagi izin bapak ibu admin saya dari bappeda kabupaten garut mau menanyakan terkait isu strategis dalam ranperda rpjmd kabupaten sumedang barangkali dapat di share untuk kepentingan dalam dokumen rpjmd kami dalam hal telaah terhadap isu strategis daerah berbatasan hatur nuhun sebelumnya,LOW
longsor telah terjadi longsor tebing di dusun cikuray desa sukasirnarasa pada tanggal oktober,HIGH
kerumitan dan ketidakjelasaan pelayanan pendaftaran bphtb di bapenda kabupaten sumedang pada senin maret saya datang ke kantor bapenda kabupaten sumedang dengan maksud untuk mengurus bphtb waris namun ternyata menurut petugas yang bernama bpk dendi pelayanan bphtb hanya bisa dilakukan secara online dan petugas tsb mengarahkan saya untuk mengurus melalui ppat wilayah sumedang karena yang memiliki akun untuk akses pengurusan bphtb online hanya ppat kemudian pada hari itu juga saya menghadap ke ppat dedeh dan sayamenyampaikan hendak menguris bphtb waris namun beliau menginformasikan untuk pengurusan bphtb waris harus ke kantor bapenda kabupaten sumedang langsung dengan alasan karena saya mengajukan melalui perorangan dan tidak ada hubungan dengan ppat masih di hari yang sama saya kembali ke kantor bapenda kabupaten sumedang dan menemui petugas yang sama yang melayani saya pada awal cerita saya menyampaikan uraian pada poin diatas dan kemudian petugas tsb menyarankan untuk ke kantor camat terkait lokasi objek selaku ppats dan disebut memiliki kewenangan pengurusan bphtb masih pada hari tsb saya datang ke kantor kecamatan pamulihan kabupaten sumedang dan saya menyampaikan kepada petugas kecamatan tsb hendak mengurus bphtb namun menurut petugas tsb kecamatan tidak berwenang mengurus bphtb alias tidak bisa hari selanjutnya saya mencoba mendatangi ppat lain dan mendapatkan informasi bahwa saya harus mengkonsultasikan kembali ke kantor bapenda kabupaten sumedang poin yang saya ingin sampaikan adalah bahwa dalam pelayanan di kantor bapenda kabupaten sumedang sangat rumit berbelit belit tidak jelas dan menunjukkan bahwa instansi tersebut tidak melakukan koordinasi kpd pihak terkait mengenai penerapan sistem bphtb tersebut hal ini jelas membuang waktu tenaga dan pikiran saya secara percuma sehingga sudah sewajarnya saya mengajukan pengaduan ini agar dapat ditindak lanjuti segera adapun yang saya harapkan adalah kemudahan dalam proses pelayanan publik di kemudian hari di wilayah manapun senin april kpd bpk dendi yang sudah memberikan penjelasan perihal bphtb online bahwa seharusnya ppat wilayah sumedang wajib membantu pendaftaran bphtb tsb dan saya dapat mengerti kondisi dan aturan tersebut namun sebagai masukan tambahan seharusnya bukan hanya ppat yang diberikan kewenangan tsb karena setelah saya telusuri lebih lanjut terdapat beberapa ppat yang menolak secara halus permohonan pendaftaran bphtb dengan berbagai alasan seharusnya pemohon perorangan juga dapat diberikan akses untuk mendaftar langsung agar mempermudah hal seperti ini kedepannya sehingga sistem tsb dapat memberikan manfaat juga bagi masyarakat umum dan selanjutnya semoga pembuat kebijakan tsb mau mengevaluasi secara komperhensif dan mau mempertimbangkan masukan ini,LOW
monyet liar sangat mengganggu warga dan juga mengganggu siswa tk ketika saat belajar desember lokasi jalan setiabudhi dalam no rukun tetangga rukun warga ledeng kec cidadap kota bandung belakang mesjid jami ar rahman kehadiran monyet liar di lingkungan pemukiman telah menjadi sumber gangguan yang sangat serius dan meresahkan bagi warga serta menimbulkan kekhawatiran besar terhadap keselamatan dan kenyamanan khususnya bagi anak anak usia tk dampak buruk terhadap warga monyet monyet ini secara rutin memasuki area perumahan dan menimbulkan berbagai masalah di antaranya pencurian makanan monyet monyet ini berani masuk ke dapur teras atau warung untuk mengambil dan merusak bahan makanan membuat warga mengalami kerugian materi perusakan properti mereka seringkali merusak atap rumah tanaman hias jemuran pakaian dan bahkan membuang sampah sembarangan setelah mengacak acak tempat sampah ancaman keamanan sifat agresif monyet terutama saat merasa terancam atau kelaparan berpotensi menggigit atau menyerang warga yang menimbulkan ketakutan khususnya pada anak anak kecil dan lansia gangguan terhadap siswa taman kanak kanak tk situasi ini menjadi lebih kritis di sekitar area sekolah tk kehadiran monyet liar sangat mengganggu proses belajar mengajar dan menciptakan lingkungan yang tidak kondusif mengalihkan perhatian kemunculan monyet di luar atau bahkan di area sekolah secara langsung mengalihkan fokus dan perhatian siswa tk yang sedang belajar menimbulkan ketakutan anak anak usia dini seringkali takut dan menangis melihat monyet yang besar dan agresif yang secara psikologis mengganggu kenyamanan mereka saat berada di sekolah ancaman di jam istirahat monyet dapat menyerang atau mencuri bekal makanan siswa saat jam istirahat yang memaksa guru harus ekstra waspada dan membatasi aktivitas bermain di luar ruangan kesimpulan diperlukan tindakan cepat dan terpadu dari pihak berwenang bersama dengan kesadaran warga untuk mengelola populasi monyet liar ini tujuan utamanya adalah mengembalikan rasa aman dan menjamin lingkungan yang tenang bagi warga serta memastikan siswa tk dapat belajar dalam suasana yang aman nyaman dan bebas dari rasa takut,HIGH
jalan berlubang akibat jalan ambrol di jalan gudang utara depan kodim mengakibatkan akses jalan macet,HIGH
parkir liar masjid ad da wah jalan sidomukti tolong tertibkan tukang parkir liar didepan masjid ad da wah d jalan sidomukti sangat menggangu dan meresahkan beberapa kai tukang parkir ini sedikit memaksa dengan bahasa buat makan buat sedekah saya sendiri jujur merasa terganggu dan tidak nyaman jika sholat d masjid tersebut apalagi kantor saya juga dekat daerah sana juga tolong ini jadi kebiasaan yang kurang baik toh klo tidak dikasih jangan ada bahasa atau kata sedekah buat makan ini terkesan mengemis dkm nya sendiri ini bagaimana lokasi masid ad da wah jalan sidomukti no sukaluyu sukaluyu cibeunying kaler kota bandung jawa barat,MEDIUM
ketua rukun tetangga rukun warga kel sadang serang kec coblong tolong di ganti ketua rukun tetangga rukun warga kel sadang serang kec coblong ini rukun tetangga udah tidak bener bapak deden ini tidak bisa ngejalanin tugasnya sebagai rukun tetangga tolong di tindak dan di ganti setiap kali di minta tanda tangan atau keperluan untuk tidak ada di tempat buat apa di pertahankan klo attitude nya saja jelek dan sebagai rukun tetangga bapak deden ini tidak jujur semenjak nikah lagi samaistri barunya banyak tuga sebagai rukun tetangga terbengkalai keluarga nyasaja tidak ter urus apalagi warganya,LOW
permohonan penebangan pohon bapak kepala dinas perumahan dan kawan permukiman kota bandung laporan dan keluhan dari warga rukun tetangga rukun warga kelurahan cigadung mengenai pohon yang tumbuh di tembok rumah dan telah mengakar kedalam tembok sehingga menyebabkan keretakan dan kebocoran bersama ini kami teruskan permohonan warga tersebut untuk dapat ditindaklanjuti sebagaimana mestinya adapun lokasi pohon yang dimaksud berada di jalan cigadung raya tengah no titik koordinat hitps shorttel al ovgb mengingat kondisi pohon yang berpotensi menimbulkan kerusakan lebih parah apabila patah atau roboh demikian kami sampaikan kami mohon kiranya bapak kepala dinas perumahan dan kawasan permukiman kota bandung dapat menindaklanjuti permohonan yang dimaksud atas perhatian dan kerja samanya kami ucapkan,MEDIUM
laporan untuk dlhk saya tinggal di area cipada tepatnya sebrang parkiran rsud cipada saya simpan sampah didepan rumah seperti biasa pada hari senin pukul lalu sampai sekarang hari selasa malem sampah saya gada yang angkut padahal petugas ada x balikan ke area tersebut al hasil sampah saya jadi berantakan entah sama kucing pemulung lalu didepan pager saya sering banyak orang yang buang sampah sembarangan tetapi setiap pagi tidak pernah di bersihkan sama petugas kebersihan tetangga saya malah sampe harus ngasih uang agar area depan rumahnya di bersihkan oleh petugas itu kan sudah pungli sedangkan kita setiap bulan bayar iuran padahal yang tinggal di area jalur tengah selalu dibersihkan sampe trotoar pun di bersihkan setiap pagi kenapa yang area belakang tidak di bersihkan juga gak adil dong bapak,MEDIUM
tpt ambruk encana tpt rumah sepanjang meter tinggi meter menimpa rumah edo umur tahun tpt yang longsor atas nama ajat umur tahun alamat dusun cimacan rukun tetangga rukun warga desa kec rancakalong tidak ada korban jiwa kronologi kejadian akibat hujan besar tpt tidak bisa menahan beban karena kondinya sudah lapuk,HIGH
mohon di bangun jalan desa karena sudah lebih dari tahun tidak di lakukan pembangunan perbaikan dengan ini saya perwakilan warga dusun kebon kopi rukun tetangga desa sukaraja kecamatan cibugel kabupaten sumedang ingin menyampaikan keluhan masyarakat tentang tidak layaknya jalan desa yang kami tempati sehubungan dengan ini kami meminta kepada pihak terkait untuk segera membangun memperbaiki jalan desa yang kami tempati karena jalan sangat tidak layak dan sudah hampir tahun tidak tersentuh pembangunan dengan dibangunya diperbaikinya jalan desa yang kami tempati harapanya dapat memperlancar laju ekonomi dan menambah ketertataan desa yang kami tinggali demikian aspirasi kami terimakasih dari kami warga dusun kebin kopi,MEDIUM
perbaikan jalan rusak selamat pagi siang malam yth admin layanan aspirasi dan pengaduan online rakyat saya seorang perempuan dan saya pengguna kendaraan bermotor saya ingin menyampaikan aspirasi sebagai berikut di dekat rumah saya terdapat jalanan rusak yang sudah lama tidak diperbaiki entah apa yang membuat jalanan ini seperti tidak diperhatikan oleh pihak yang berwenang sehingga jalanan yang sudah rusak kian lama tidak diperbaiki akhirnya menjadi semakin rusak sebagai pengendara saya khawatir jalanan yang rusak ini akan memakan korban seiring berjalannya waktu karena tidak sedikit kasus pengendara yang jatuh akibat kondisi jalan yang rusak maka dari itu tujuan saya menuliskan aspirasi disini untuk menginformasikan kabar ini dan saya harap jalan rusak ini bisa segera diperbaiki adapun lokasi jalan ini terletak di daerah susugan yang menghubungkan darangdan kec sumedang selatan dengan padasuka kec sumedang utara terimakasih atas perhatiannya saya harap aspirasi yang saya ajukan ini dapat segera ditangani oleh pihak berwenang,HIGH
